{
  "$schema": "http://json-schema.org/draft-07/schema#",
  "$id": "https://openclaw-sdlc-multi-agent/contracts/approval-response.schema.json",
  "title": "ApprovalResponse",
  "type": "object",
  "additionalProperties": false,
  "required": [
    "schema_version", "decision_id", "workflow_id", "task_id", "run_id",
    "outcome", "chosen_option_id", "raw_user_reply_summary", "decided_by",
    "decided_at", "notes"
  ],
  "properties": {
    "schema_version": { "type": "integer", "const": 1 },
    "decision_id": { "type": "string", "pattern": "^DEC-" },
    "workflow_id": { "type": "string", "pattern": "^WF-" },
    "task_id": { "type": ["string", "null"], "pattern": "^TASK-" },
    "run_id": { "type": ["string", "null"], "pattern": "^RUN-" },
    "outcome": { "type": "string", "enum": ["APPROVED", "REJECTED", "MODIFIED"] },
    "chosen_option_id": { "type": ["string", "null"] },
    "raw_user_reply_summary": { "type": "string", "minLength": 1 },
    "decided_by": { "type": "string", "minLength": 1 },
    "decided_at": { "type": "string", "format": "date-time" },
    "notes": { "type": "string" }
  }
}
